{"run":69,"commit":"b938db6","metric":110780314,"metrics":{},"status":"discard","description":"Hypothesis: current best workload clamps to 2 workers, so replacing `% self.senders.len()` with a tiny `next_worker_index()` fast path for 1- and 2-worker pools might shave round-robin submit overhead in the persistent pool. Result regressed to 110.78ms vs 104.88ms best, so the extra helper branching is worse than the plain modulo path here. Rollback reason: worse primary metric. Next action hint: keep the simpler round-robin submit logic; sender-index arithmetic is not worth special-casing.","timestamp":1776551544329,"segment":2,"confidence":119.70964038365774,"iterationTokens":1691}
{"run":70,"commit":"b938db6","metric":273815668,"metrics":{},"status":"discard","description":"Hypothesis: the previous queue win may have come mostly from bounded job delivery, so keeping the worker job queue bounded while reverting the per-job result queue back to an unbounded channel might trim result-path overhead further. Result cratered to 273.82ms vs 104.88ms best, so the bounded one-slot result queue is clearly essential to the persistent pool win. Rollback reason: catastrophically worse primary metric. Next action hint: keep both job and result delivery bounded; mixed bounded/unbounded channels are a dead end here.","timestamp":1776551662261,"segment":2,"confidence":97.71844857215193,"iterationTokens":7189}
{"run":71,"commit":"b938db6","metric":0,"metrics":{},"status":"crash","description":"Hypothesis: test the other mixed queue variant by keeping the per-job result queue bounded but reverting the long-lived worker job queue to an unbounded channel, to see which queue side drives the persistent-pool win. Crash: first cut changed the worker channel constructor without changing the pool sender type, so the build failed with a `Sender` vs `SyncSender` mismatch. Rollback reason: compile error from incomplete mixed-queue change. Next action hint: if we still want this variant, change the pool sender type consistently and rerun; otherwise result from the opposite mixed variant already suggests mixed queues are probably a dead end.","timestamp":1776551682377,"segment":2,"confidence":97.71844857215193,"iterationTokens":827}
{"run":72,"commit":"b938db6","metric":106353199,"metrics":{},"status":"discard","description":"Hypothesis: after the persistent worker-pool win, re-test the old 1-worker clamp because reduced thread overhead might make one whole-program deep export beat the current 2-worker split. Raising `MIN_ROOTS_PER_WORKER` to 16 makes the 16-root fixture use 1 worker again, but it still regressed to 106.35ms vs 104.88ms best. Rollback reason: worse primary metric. Next action hint: keep the 2-worker clamp; persistent worker reuse did not flip the old 1-vs-2 worker result.","timestamp":1776551748967,"segment":2,"confidence":116.8665632110118,"iterationTokens":2612}
{"run":73,"commit":"2ae8532","metric":0,"metrics":{},"status":"crash","description":"Hypothesis: re-baseline current HEAD before new experiments. Runner invocation failed because autoresearch mode requires the checked-in harness entrypoint directly (`./autoresearch.sh` or `bash autoresearch.sh`), not a wrapped `cd && ...` command. Rollback reason: harness policy rejection, no benchmark data captured. Next action hint: rerun via `run_experiment` with command `./autoresearch.sh` from repo root.","timestamp":1776876099452,"segment":2,"confidence":116.8665632110118,"iterationTokens":2612,"asi":{"hypothesis":"re-baseline current HEAD before new experiments","rollback_reason":"run_experiment rejected a wrapped command instead of executing the harness","next_action_hint":"rerun with command './autoresearch.sh' directly"}}
{"run":74,"commit":"41512b1","metric":104470786,"metrics":{},"status":"keep","description":"Baseline re-measurement on current HEAD before new code changes. Current tree beats the prior recorded best slightly at 104.47ms vs 104.88ms, so keep this fresh benchmark anchor before trying further pool hot-path work.","timestamp":1776876174972,"segment":2,"confidence":120.72162995840588,"iterationTokens":2612,"asi":{"hypothesis":"current HEAD may have a slightly different baseline and should be re-measured before new changes","baseline_context":"fresh session after preserving unrelated dirty worktree in stash@{0}","observed_delta_ns":"-406182 vs previous kept best 104876968","next_action_hint":"optimize custom worker-pool hot path from this clean baseline"}}
{"run":75,"commit":"aa5df65","metric":109968627,"metrics":{},"status":"discard","description":"Tried trimming bounded worker-pool overhead by replacing per-assignment label Vec clones with requested-label ranges and by using one shared result channel per execute call instead of one result channel per worker job. The combined refactor regressed the parallel all-roots benchmark from the fresh 104.47ms baseline to 109.97ms, so the old per-job receiver path was faster on this workload.","timestamp":1776984643930,"segment":2,"confidence":133.3910324852123,"iterationTokens":2612,"asi":{"hypothesis":"range-based worker assignments plus a single shared collector channel would reduce small per-call allocation and channel overhead in force_all_roots_bounded","rollback_reason":"primary metric regressed by about 5.5ms versus the current baseline","next_action_hint":"revert this shared-result/range-assignment path and try a thinner worker request protocol or lower-risk instrumentation instead","observed_regression_ns":"5497841","notes":"Session tests still passed before the benchmark, so the loss is performance-only rather than a correctness regression."}}
{"run":76,"commit":"aa5df65","metric":109184173,"metrics":{},"status":"discard","description":"Tried only the range-based assignment half of the prior refactor while keeping the existing per-job result receivers and round-robin pool submit path. Replacing chunk-owned label Vecs with requested-label index ranges still regressed the benchmark from the fresh 104.47ms baseline to 109.18ms, so the current chunk-owned assignment layout appears to help codegen more than it hurts allocations on this workload.","timestamp":1776984900568,"segment":2,"confidence":149.03147529877003,"iterationTokens":16777,"asi":{"hypothesis":"removing per-assignment label Vec clones while preserving the existing per-job result channel path would shave bounded all-roots worker setup overhead","rollback_reason":"primary metric regressed by about 4.7ms versus the current baseline","next_action_hint":"keep the current chunk-owned WorkerAssignment shape and look for deeper worker-pool or Nickel-eval levers instead of assignment-layout refactors","observed_regression_ns":"4713387","notes":"Targeted session tests still passed before benchmarking, so the loss is again performance-only."}}
{"run":77,"commit":"aa5df65","metric":107388480,"metrics":{},"status":"discard","description":"Tried specializing only the all-roots entry point so it builds the existing chunk-owned `WorkerAssignment { labels: Vec<String> }` directly from `RootLabel`s, avoiding the extra full-label Vec clone in `force_all_roots_with_policy` while leaving the worker-pool path unchanged. It still regressed the benchmark from the fresh 104.47ms baseline to 107.39ms, so even this mild all-roots-only specialization hurt optimized codegen more than the saved outer label clone helped.","timestamp":1776985114800,"segment":2,"confidence":165.4914338315154,"iterationTokens":9455,"asi":{"hypothesis":"avoiding the extra all-roots label Vec clone while preserving the current worker-assignment and per-job result-channel path would trim bounded all-roots setup cost","rollback_reason":"primary metric regressed by about 2.9ms versus the current baseline","next_action_hint":"drop all-roots label-specialization ideas and focus on deeper worker-session or Nickel-eval costs instead of label cloning","observed_regression_ns":"2917694","notes":"The added helper-equivalence unit test and the existing session tests passed before the benchmark; the change was behavior-preserving but slower."}}
{"run":78,"commit":"aa5df65","metric":108819912,"metrics":{},"status":"discard","description":"Tried keeping the current worker-pool structure but storing chunk-owned assignment labels in `SmallVec<[String; MIN_ROOTS_PER_WORKER]>` so the common 8-label chunks can stay inline instead of heap-allocating a Vec per assignment and assignment clone. That still regressed the benchmark from the fresh 104.47ms baseline to 108.82ms, so the heavier inline `SmallVec` layout hurt this hot path more than it saved in heap churn.","timestamp":1776985356174,"segment":2,"confidence":180.23975469258403,"iterationTokens":13891,"asi":{"hypothesis":"inline smallvec storage for the common 8-label worker chunks would reduce heap allocation overhead without changing worker-pool behavior","rollback_reason":"primary metric regressed by about 4.35ms versus the current baseline","next_action_hint":"drop assignment-container micro-tuning and focus on deeper worker-session or Nickel evaluation costs","observed_regression_ns":"4349126","notes":"Relevant session tests still passed before the benchmark; the regression is performance-only."}}
{"run":79,"commit":"aa5df65","metric":117407171,"metrics":{},"status":"discard","description":"Tried pre-warming worker sessions by calling `Context::eval_shallow()` inside `open_worker_source()` before the later `eval_deep_for_export()`, hoping the worker Context would reuse the same warm-path advantages the coordinator gets after `open_file()`. It regressed badly from the fresh 104.47ms baseline to 117.41ms, so worker `eval_shallow()` cost was additive rather than a helpful warm-up for worker deep export on this Nickel path.","timestamp":1776986311924,"segment":2,"confidence":165.4914338315154,"iterationTokens":5119,"asi":{"hypothesis":"a worker-side shallow eval before deep export would warm Nickel context state and reduce per-worker deep-eval cost","rollback_reason":"primary metric regressed by about 12.94ms versus the current baseline","next_action_hint":"do not pre-warm worker contexts with eval_shallow; look for ways to avoid duplicate worker deep exports entirely or target other Nickel internals","observed_regression_ns":"12936385","notes":"Relevant session tests still passed before the benchmark, so the worker warm-up changed only performance, not correctness."}}
{"run":80,"commit":"aa5df65","metric":109641120,"metrics":{},"status":"discard","description":"Tried a thinner threaded dispatch path that keeps the existing worker pool, result channels, and chunk-owned `WorkerAssignment { labels: Vec<String> }` layout but moves assignments into worker closures instead of cloning each assignment in the threaded executor. That still regressed the benchmark from the fresh 104.47ms baseline to 109.64ms, so even the per-assignment Vec<String> clone appears cheaper than the control-flow reshaping needed to avoid it.","timestamp":1776986650396,"segment":2,"confidence":180.23975469258403,"iterationTokens":1343,"asi":{"hypothesis":"consuming worker assignments directly in the threaded path would cut hot-path label-clone overhead without revisiting the already-bad assignment-shape changes","rollback_reason":"primary metric regressed by about 5.17ms versus the current baseline","next_action_hint":"stop chasing WorkerAssignment clone elimination and move to deeper worker protocol or Nickel-boundary experiments","observed_regression_ns":"5170334","notes":"The relevant crunch-eval session tests still passed before benchmarking; this was another performance-only loss."}}
{"run":81,"commit":"aa5df65","metric":0,"metrics":{},"status":"crash","description":"Tried a deeper Nickel-core worker path by adding a direct `nickel-lang-core` dependency and prototyping worker evaluation through `Program::new_from_source(...).eval_full_for_export()` instead of the public `Context` wrapper. The experiment failed before benchmarking because adding direct `nickel-lang-core = 0.16.1` pulled `topiary-core` and a conflicting `wasm-bindgen = 0.2.100`, which clashes with the workspace's existing `wasm-bindgen = 0.2.117` selection via reqwest/crunch-store.","timestamp":1776986948947,"segment":2,"confidence":180.23975469258403,"iterationTokens":35196,"asi":{"hypothesis":"using nickel-lang-core Program directly in worker sessions might avoid the public Context path's repeated source-add overhead and reduce per-worker deep-export cost","rollback_reason":"workspace dependency resolution failed before the code could compile or benchmark","next_action_hint":"avoid a naive direct nickel-lang-core dependency bump; if pursuing core internals, inspect whether nickel-lang re-exports enough internals, use the exact transitive version/features already in the lockfile, or prototype in an isolated scratch crate first","error_detail":"wasm-bindgen version conflict between topiary-core's pinned 0.2.100 and workspace-selected 0.2.117"}}
{"run":82,"commit":"aa5df65","metric":109505463,"metrics":{},"status":"discard","description":"Retried the deeper Nickel-core worker idea with `nickel-lang-core = { default-features = false }` so the prototype could compile: worker assignments used `Program::new_from_source(...).eval_full_for_export()` plus direct core-value field extraction/deserialization instead of the public `Context` wrapper. It still regressed the benchmark from the fresh 104.47ms baseline to 109.51ms, so even without the earlier dependency-conflict baggage the core Program path is slower than the current public worker-session path on this workload.","timestamp":1776987151903,"segment":2,"confidence":191.30322550789276,"iterationTokens":9397,"asi":{"hypothesis":"a minimal-feature nickel-lang-core Program path in worker sessions would avoid public Context source-add overhead and reduce per-worker deep-export cost","rollback_reason":"primary metric regressed by about 5.03ms versus the current baseline","next_action_hint":"drop the direct Program worker path; remaining wins likely need a truly thinner request/result protocol or a different Nickel internal seam than Program::eval_full_for_export","observed_regression_ns":"5034677","notes":"The focused crunch-eval session tests passed before benchmarking, so this was another behavior-preserving but slower deep-internal path."}}
{"run":83,"commit":"3376597","metric":104018222,"metrics":{},"status":"keep","description":"Replace per-job result receivers with reusable per-worker result slots in the persistent bounded worker pool. Each worker now keeps a permanent result slot backed by a mutex/condvar while the existing boxed job closure and chunk-owned assignments stay unchanged, which removes the hot-path `sync_channel(1)` allocation on every submitted job without revisiting the label/container refactors that already regressed.","timestamp":1776987334415,"segment":2,"confidence":188.05311696783434,"iterationTokens":6688,"asi":{"hypothesis":"reusable per-worker result slots would remove the remaining per-job result-channel allocation cost while preserving the worker pool, round-robin dispatch, and current assignment shape","observed_improvement_ns":"452564","mechanism":"BoundedWorkerPool now pairs each persistent worker thread with a reusable result slot; submit clears the slot, enqueues the boxed job, and collect_threaded_results waits on/takes the slot payload instead of allocating a fresh receiver per job","kept_because":"primary metric improved versus the fresh 104.47ms baseline while preserving the existing session tests","next_action_hint":"confirm the win with a no-code rerun and, if it holds, expose actual effective bounded concurrency in benchmark metrics so the measurement matches the clamp-to-2-worker behavior"}}
{"run":84,"commit":"de38685","metric":101648925,"metrics":{},"status":"keep","description":"Confirmation rerun after the reusable per-worker result-slot change. The same code improved again, from the previous 104.02ms result down to 101.65ms, which strengthens confidence that removing the per-job result-channel allocation was a real win and not a one-off noisy sample.","timestamp":1776987421137,"segment":2,"confidence":175.61117504173086,"iterationTokens":1783,"asi":{"hypothesis":"the reusable per-worker result-slot change should continue to beat the old per-job receiver path on a fresh isolated rerun","observed_improvement_ns":"2369297","kept_because":"same-code confirmation rerun improved further and raised confidence in the result","next_action_hint":"with the pool result-slot win confirmed, either expose actual effective bounded concurrency in benchmark metrics or attempt the harder boxed-job elimination separately without disturbing the new slot design"}}
{"run":85,"commit":"de38685","metric":101870609,"metrics":{},"status":"discard","description":"Tried the harder request-slot follow-up on top of the reusable result-slot win: replace boxed worker-job closures with a concrete `WorkerRequest` struct carrying the worker input, assignment, typed function pointer, and result slot, while keeping the new reusable result slots. This preserved behavior but regressed slightly from the confirmed 101.65ms best to 101.87ms, so boxed job closures are not the next hot-path bottleneck after the result-slot improvement.","timestamp":1776987577733,"segment":2,"confidence":169.34111736081152,"iterationTokens":5910,"asi":{"hypothesis":"eliminating boxed worker-job closures with a concrete typed WorkerRequest protocol would stack another small win on top of reusable result slots","rollback_reason":"primary metric regressed by about 0.22ms versus the current best kept code","next_action_hint":"keep the reusable result-slot design but stop here on worker-protocol surgery; the next useful step is likely benchmark-metric accuracy (effective concurrency) or a different Nickel-level seam","observed_regression_ns":"221684","notes":"Focused crunch-eval session tests still passed before benchmarking, so the change was behavior-preserving but slower."}}
{"run":86,"commit":"934e261","metric":99496663,"metrics":{},"status":"keep","description":"Swap the reusable worker-result slots from `std::sync::{Mutex, Condvar}` to `parking_lot::{Mutex, Condvar}`. The result-slot design already removed per-job result receivers; using the lighter-weight parking_lot primitives trims the remaining lock/wake overhead on the hot path without changing the worker pool, assignment shape, or boxed-job protocol.","timestamp":1776987782439,"segment":2,"confidence":166.00091021543417,"iterationTokens":7737,"asi":{"hypothesis":"parking_lot mutex/condvar primitives would make the kept reusable result-slot design cheaper than the std synchronization path","observed_improvement_ns":"2152262","kept_because":"primary metric improved materially versus the confirmed 101.65ms kept result while preserving the focused session tests","next_action_hint":"confirm the parking_lot win with a rerun; if it holds, the remaining nearby improvement is likely metric/reporting accuracy rather than more worker-protocol surgery"}}
{"run":87,"commit":"934e261","metric":104529025,"metrics":{},"status":"discard","description":"Confirmation rerun of the parking_lot result-slot change did not reproduce the big first-sample win. The same code landed back at 104.53ms, essentially on top of the old 104.47ms baseline and far above the 99.50ms outlier, so the apparent parking_lot gain is not yet trustworthy.","timestamp":1776987861693,"segment":2,"confidence":162.06289411318673,"iterationTokens":891,"asi":{"hypothesis":"if parking_lot is a real improvement over std sync for result slots, a fresh rerun of the same code should stay clearly below the old ~101.65ms and baseline ~104.47ms levels","rollback_reason":"same-code confirmation rerun lost the initial win and landed near baseline, so the change is not yet proven beneficial","next_action_hint":"benchmark an explicit revert of the parking_lot change against the committed version before treating it as a durable optimization","observed_regression_ns":"5032362","notes":"No code changes were pending during the confirmation rerun; this is pure measurement evidence against over-trusting the first low sample."}}
{"run":88,"commit":"bfb7224","metric":103104084,"metrics":{},"status":"keep","description":"Revert the parking_lot swap and restore the reusable result-slot implementation to `std::sync::{Mutex, Condvar}`. The parking_lot version produced one strong outlier but failed its no-code confirmation rerun; explicitly restoring the std sync path improved the metric from that confirmed 104.53ms level down to 103.10ms, which is a better fit for a durable result than keeping the noisy parking_lot variant.","timestamp":1776987998031,"segment":2,"confidence":156.87864253984873,"iterationTokens":4072,"asi":{"hypothesis":"if the parking_lot win was noise, restoring the previous std sync result-slot path should beat the confirmed parking_lot rerun and recover a more trustworthy latency level","observed_improvement_ns":"1424941","kept_because":"explicitly reverting the unconfirmed parking_lot change improved the metric relative to the confirmed parking_lot rerun while preserving focused session tests","next_action_hint":"confirm the std-sync revert with another no-code rerun; if it stays near or below ~103ms, keep std sync and move on to measurement accuracy or a new seam"}}
