{"type":"config","name":"Lazy root evaluation selected-root latency","metricName":"selected_root_total_wall_ns","metricUnit":"","bestDirection":"lower"}
{"run":1,"commit":"bb23601","metric":0,"metrics":{},"status":"crash","description":"Initial lazy-root benchmark harness compile failed because Nickel Context::eval_shallow() returns NickelError directly; added plan to map NickelError into local benchmark Error before rerunning.","timestamp":1776441327403,"segment":0,"confidence":null,"iterationTokens":124}
{"run":2,"commit":"a59d0a8","metric":72374220,"metrics":{},"status":"keep","description":"Initial lazy-root autoresearch harness: added wide checked-in fixture, shallow discovery benchmark, eager selected-root baseline, and checks. Baseline medians show selected_root_total_wall_ns=72.4ms with current eager path forcing all 128 roots.","timestamp":1776441566040,"segment":0,"confidence":null,"iterationTokens":15411}
{"run":3,"commit":"79aeb66","metric":64278442,"metrics":{},"status":"keep","description":"Selected-root force now uses a wrapper evaluation of only the requested record field instead of eager all-root extraction. Benchmark counts drop from 128/127 to 1/0 and selected_root_total_wall_ns improves from 72.4ms to 64.3ms while all_roots_total_wall_ns guardrail stays 38.9ms.","timestamp":1776442388564,"segment":0,"confidence":null,"iterationTokens":25157}
{"run":4,"commit":"fda7e76","metric":32976713,"metrics":{},"status":"keep","description":"Reused one Nickel Context across discovery and selected-root force by importing the fixture through a synthetic session source. Selected_root_force_wall_ns dropped from 32.2ms to 0.27ms while discovery stayed ~32.7ms; selected_root_total_wall_ns improved from 64.3ms to 33.0ms with counts still 1/0.","timestamp":1776442481949,"segment":0,"confidence":4.07332229218736,"iterationTokens":6573}
{"run":5,"commit":"8b89ce8","metric":32874565,"metrics":{},"status":"keep","description":"Confirmation rerun of the shared-Context wrapper benchmark. Same code reproduced the big win: selected_root_total_wall_ns nudged from 32.98ms to 32.87ms, keeping discovery ~32.5ms and selected_root_force_wall_ns under 0.30ms.","timestamp":1776442733162,"segment":0,"confidence":2.093662830229529,"iterationTokens":18763}
{"run":6,"commit":"8b89ce8","metric":127676291,"metrics":{},"status":"discard","description":"Tried nickel-lang-core Program-backed discovery and selected-root forcing. Big regression: selected_root_total_wall_ns jumped to 127.7ms and discovery alone to 126.7ms, so Program::query/eval_full_for_export is much heavier than the current Context+wrapper path for this workload.","timestamp":1776443440841,"segment":0,"confidence":1.0502475757808778,"iterationTokens":9644}
{"run":7,"commit":"8b89ce8","metric":0,"metrics":{},"status":"crash","description":"Tried refining the nickel-lang-core path to use Program::parse() for syntactic top-level record labels plus Program field selection for selected-root force. It crashed before benchmarking: Program::parse() panicked inside nickel-lang-core with `File parsed and then immediately accessed doesn't exist`, so this path is not stable enough for the loop.","timestamp":1776443713680,"segment":0,"confidence":1.0502475757808778,"iterationTokens":16723}
{"run":8,"commit":"8b89ce8","metric":43071940,"metrics":{},"status":"discard","description":"Tried replacing eval_shallow-based discovery with wrapper `std.record.fields(import fixture)` via eval_deep_for_export, while moving benchmark/check scripts to a disk-backed CARGO_TARGET_DIR. Discovery regressed badly: root_discovery_wall_ns rose from ~32.5ms to 42.6ms and selected_root_total_wall_ns to 43.1ms, so deep export of field names defeats the shared-Context win even though force still stayed under 0.5ms.","timestamp":1776444085808,"segment":0,"confidence":1.6688652406356574,"iterationTokens":16723}
{"run":9,"commit":"8b89ce8","metric":35217162,"metrics":{},"status":"discard","description":"Tried discovering root labels from the already-read fixture source string with Context::eval_shallow(source) while still forcing the selected root via the import-wrapper path. Mixed result: discovery improved to 31.6ms, but selected_root_force_wall_ns regressed to 3.47ms, so losing the old import-cache reuse made selected_root_total_wall_ns land at 35.2ms instead of the 32.9ms best.","timestamp":1776444264203,"segment":0,"confidence":3.223826229789529,"iterationTokens":33065}
{"run":10,"commit":"8b89ce8","metric":0,"metrics":{},"status":"crash","description":"Tried keeping the shallow root record alive and forcing only the selected field with Context::eval_expr_shallow before direct to_serde deserialization. Nickel only reduced the field to WHNF: CrunchDerivation deserialization failed with `invalid type: Other, expected: String`, so at least one derivation field still needs recursive forcing beyond a single shallow step.","timestamp":1776444401150,"segment":0,"confidence":3.223826229789529,"iterationTokens":15603}
{"run":11,"commit":"8b89ce8","metric":32308071,"metrics":{},"status":"discard","description":"Prototype public-API fast path: reuse one shallow root record, then lazily force only the selected derivation and manually decode simple string/array fields. It improved selected_root_total_wall_ns to 32.31ms with selected_root_force_wall_ns down to 0.20ms, but the implementation only handled the benchmark fixture shape (no env/inputs/fixed_output/provenance) inside example support, so it is not general enough to keep yet.","timestamp":1776444621721,"segment":0,"confidence":5.016541453661117,"iterationTokens":15493}
{"run":12,"commit":"79b3b51","metric":32315142,"metrics":{},"status":"keep","description":"Generalized the fast path into production seams: `crunch_eval::ShallowRecordSession` now keeps one shallow top-level record alive, and `crunch_glue::decode_crunch_derivation_lazy()` recursively forces only the selected derivation fields. Benchmark improved from 32.87ms to 32.32ms total with selected_root_force_wall_ns down to 0.19ms, while new tests cover bad siblings plus nested env/inputs/fixed_output/provenance so the win is not fixture-only.","timestamp":1776445389608,"segment":0,"confidence":11.108329715364697,"iterationTokens":54785}
{"run":13,"commit":"51ac5e5","metric":31974335,"metrics":{},"status":"keep","description":"Added `ShallowRecordSession::scan_for_label()` so selected-root discovery can scan the shallow top-level record for count+target presence without allocating owned label strings on the hot path. Benchmark improved from 32.32ms to 31.97ms total while preserving root_count=128, selected-label validation, and the same lazy selected-root force path.","timestamp":1776445637930,"segment":0,"confidence":16.349016188035748,"iterationTokens":16446}
{"run":14,"commit":"0b016c2","metric":31247598,"metrics":{},"status":"keep","description":"Made `ShallowRecordSession::scan_for_label()` use the shallow record’s O(1)-style metadata path (`len()` plus direct field lookup) instead of iterating every top-level field. That keeps the selected-root discovery API general while dropping selected_root_total_wall_ns from 31.97ms to 31.25ms and root_discovery_wall_ns to 31.06ms on the same 128-root fixture.","timestamp":1776445741595,"segment":0,"confidence":18.071440014111264,"iterationTokens":16446}
{"run":15,"commit":"0b016c2","metric":0,"metrics":{},"status":"crash","description":"Tried fusing discovery and selection into one `scan_and_select_field()` helper so benchmark path could reuse the selected Expr instead of looking it up twice. First compile failed because the new `SelectedTopLevelField` derived `Debug`, but `nickel_lang::Expr` is not `Debug`; fix is trivial, then rerun to measure whether the saved lookup matters.","timestamp":1776445837355,"segment":0,"confidence":18.071440014111264,"iterationTokens":7581}
{"run":16,"commit":"0b016c2","metric":53871842,"metrics":{},"status":"discard","description":"Tried fusing discovery and selection into one `scan_and_select_field()` helper so the benchmark could reuse the selected Expr and skip a second lookup. Big regression: cloning the selected field Expr during discovery was much more expensive than the cheap presence probe, pushing selected_root_total_wall_ns to 53.9ms and root_discovery_wall_ns to 53.4ms.","timestamp":1776445933729,"segment":0,"confidence":12.569574624965457,"iterationTokens":4442}
{"run":17,"commit":"b764a77","metric":30424855,"metrics":{},"status":"keep","description":"Added `ShallowRecordSession::field_count()` and stopped re-checking selected-label presence during discovery. The selected-root path now counts top-level roots in discovery and lets the force step own selected-field lookup, which dropped selected_root_total_wall_ns from 31.25ms to 30.42ms and root_discovery_wall_ns to 30.24ms without changing force counts or the 128-root guardrail.","timestamp":1776446048534,"segment":0,"confidence":13.579802530653454,"iterationTokens":5238}
{"run":18,"commit":"b764a77","metric":32382673,"metrics":{},"status":"discard","description":"Tried pre-scanning derivation records into a `DerivationFieldExprs` struct so lazy decode could trade repeated named lookups for one iterator pass. It regressed badly: selected_root_total_wall_ns rose to 32.38ms and selected_root_force_wall_ns to 0.23ms, so the extra top-level iteration and field collection cost more than the old direct lookups on this workload.","timestamp":1776446251710,"segment":0,"confidence":15.329066365978733,"iterationTokens":13184}
{"run":19,"commit":"b764a77","metric":32977692,"metrics":{},"status":"discard","description":"Tried caching `nickel_lang::Record` handles through lazy derivation decode so the hot path would avoid repeated `Expr::as_record()` calls and named-lookups would share one borrowed record view. It regressed to 32.98ms total and 0.22ms selected-force, so the extra wrapper plumbing and record-handle threading cost more than the old direct helper calls.","timestamp":1776446471225,"segment":0,"confidence":17.595622616193832,"iterationTokens":4323}
{"run":20,"commit":"b764a77","metric":32691237,"metrics":{},"status":"discard","description":"Tried precomputing a reusable `ShallowRecordSessionConfig` so repeated benchmark samples could skip re-deriving source-name and import-path metadata before each `eval_shallow`. It regressed to 32.69ms total and 32.48ms discovery, so cloning the prepared config each sample was slower than rebuilding those tiny path-derived values inline.","timestamp":1776446584806,"segment":0,"confidence":23.14253549838458,"iterationTokens":6957}
{"run":21,"commit":"b764a77","metric":43344960,"metrics":{},"status":"discard","description":"Tried caching top-level field count inside `ShallowRecordSession` so discovery would avoid a second `as_record().len()` after `eval_shallow`. It regressed badly to 43.34ms total and 43.05ms discovery; whatever borrow/layout/codegen change that added around session construction outweighed the saved lookup, so keep field_count computed on demand.","timestamp":1776446685426,"segment":0,"confidence":17.595622616193832,"iterationTokens":4764}
{"run":22,"commit":"b764a77","metric":122306598,"metrics":{},"status":"discard","description":"Tried making `ShallowRecordSession::field_count()` and `scan_for_label()` infallible now that the session constructor already validates top-level roots. That should have been a pure API/codegen cleanup, but benchmark cratered to 122.3ms total and 121.4ms discovery, so this reshaping clearly hurt optimized codegen on the hot path and is not worth keeping.","timestamp":1776446774775,"segment":0,"confidence":15.329066365978733,"iterationTokens":3678}
{"run":23,"commit":"b764a77","metric":73098888,"metrics":{},"status":"discard","description":"Tried a general simple-derivation fast path in `decode_crunch_derivation_lazy()` that detects absent complex fields (`env`/`inputs`/`fixed_output`/`provenance`) and decodes simple roots through direct `Record` lookups before falling back. It cratered to 73.10ms total and 72.44ms discovery, so the extra branch/helper layer hurt codegen far more than it saved on the benchmark’s simple derivations.","timestamp":1776446997700,"segment":0,"confidence":13.58573903646845,"iterationTokens":18894}
{"run":24,"commit":"b764a77","metric":31176435,"metrics":{},"status":"discard","description":"Tried adding `#[inline]` hints on hot `ShallowRecordSession` and lazy-derivation decode helpers to encourage cross-crate inlining across the benchmark path. It still regressed from 30.42ms to 31.18ms total, so the compiler’s default inlining choices were better than the forced hints here.","timestamp":1776447058404,"segment":0,"confidence":15.059099513528135,"iterationTokens":2812}
{"type":"config","name":"Lazy root evaluation selected-root latency","metricName":"selected_root_total_wall_ns","metricUnit":"","bestDirection":"lower"}
{"run":25,"commit":"df0be0e","metric":32966176,"metrics":{"root_discovery_wall_ns":32767684,"selected_root_force_wall_ns":198492,"explicit_top_level_root_force_count":1,"explicit_nonselected_root_force_count":0,"all_roots_total_wall_ns":41362726},"status":"keep","description":"Baseline re-measurement at session start. Current best code from prior session (field_count + no redundant label check). selected_root_total=32.97ms, discovery=32.77ms, force=0.20ms. Prior session best was 30.42ms median — variance is expected across sessions.","timestamp":1776466371507,"segment":1,"confidence":null,"iterationTokens":393,"asi":{"bottleneck":"discovery is 99.4% of total — almost entirely Nickel eval_shallow cost","force_status":"0.20ms is negligible, no room to optimize","nickel_api":"eval_shallow is the cheapest Nickel API (WHNF only), can't go lower","prior_dead_ends":"inline hints, caching field_count, precomputing config, fusing scan+select, DerivationFieldExprs pre-scan, Record handle caching — all regressed","remaining_angles":"Context::new() overhead isolation, import_paths Vec allocation, source_name String allocation, reduce fixture-independent per-session overhead, profile parsing vs VM eval split"}}
{"type":"config","name":"Parallel root evaluation all-roots throughput","metricName":"parallel_all_roots_total_wall_ns","metricUnit":"ns","bestDirection":"lower"}
{"run":26,"commit":"110f56a","metric":803100983,"metrics":{},"status":"keep","description":"Implemented isolated-worker bounded root forcing, streamed pipeline eval/convert into the worker, added parallel all-root benchmark coverage and captured the first parallel_all_roots_total_wall_ns baseline bundle for the wide fixture.","timestamp":1776543692574,"segment":2,"confidence":null,"iterationTokens":6424}
{"run":27,"commit":"135d17c","metric":0,"metrics":{},"status":"crash","description":"Tried reducing parallel all-root overhead by reusing one isolated session per worker chunk instead of reopening a session per label. Benchmark run crashed before measurement because Cargo target dir `target/autoresearch-parallel-root` became unusable (`quote` failed with `E0463: can't find crate proc_macro2`) after prior test/build reuse.","timestamp":1776544710380,"segment":2,"confidence":null,"iterationTokens":7702}
{"run":28,"commit":"40240bd","metric":113847014,"metrics":{},"status":"keep","description":"Reduced bounded parallel all-root overhead by reusing one isolated EvaluationSession per worker chunk instead of reopening a worker session per label. Also switched autoresearch to fresh per-run Cargo target dirs to avoid shared-target corruption and benchmark contamination.","timestamp":1776544920904,"segment":2,"confidence":null,"iterationTokens":9576}
{"run":29,"commit":"e3a9b88","metric":113358595,"metrics":{},"status":"keep","description":"Reused coordinator-discovered root shape and labels inside IsolatedWorkerInput so worker sessions skip repeated shallow discovery before deep forcing. This trims bounded parallel all-root time slightly beyond the per-worker-session reuse change.","timestamp":1776545070724,"segment":2,"confidence":1412.194013746394,"iterationTokens":7343}
{"run":30,"commit":"e3a9b88","metric":281636213,"metrics":{},"status":"discard","description":"Tried pre-resolving requested labels to top-level indexes and skipping per-force label lookup inside worker sessions. That extra assignment/index plumbing regressed parallel_all_roots_total_wall_ns badly (281.6ms vs 113.4ms), so revert and keep the simpler worker-chunk session reuse design.","timestamp":1776545457049,"segment":2,"confidence":8.197672348796855,"iterationTokens":7893}
{"run":31,"commit":"3ff4841","metric":109182576,"metrics":{},"status":"keep","description":"Applied the coordinator-derived worker metadata to the actual bounded parallel path: force_worker_assignment now opens worker sessions from cached shape+labels via open_worker_source instead of re-running shallow discovery in each worker. This removes redundant per-worker discovery before deep forcing.","timestamp":1776545778255,"segment":2,"confidence":148.76784877406453,"iterationTokens":6771}
{"run":32,"commit":"38998b3","metric":108256949,"metrics":{},"status":"keep","description":"Shrank worker-session label metadata to each worker chunk's requested subset instead of cloning the full discovered root-label list into every worker session. This keeps the cached shape reuse but trims per-worker label cloning and lookup work.","timestamp":1776545882411,"segment":2,"confidence":142.29736995913612,"iterationTokens":6193}
{"run":33,"commit":"38998b3","metric":0,"metrics":{},"status":"crash","description":"Tried reducing worker-input clone cost by converting session/worker source metadata to Arc-backed shared state (`Arc<str>`, `Arc<[OsString]>`, `Arc<[RootLabel]>`). The benchmark command crashed before measurement with a transient Cargo build failure (`can't find crate for gix_odb` / `fuse_backend_rs`) while compiling vendor dependencies into a fresh target dir.","timestamp":1776546252174,"segment":2,"confidence":142.29736995913612,"iterationTokens":12185}
{"run":34,"commit":"38998b3","metric":109512143,"metrics":{},"status":"discard","description":"Hypothesis: Arc-back shared IsolatedWorkerInput metadata (source/import_paths/source_name/labels) would cut worker-input clone cost across bounded parallel all-roots. Result: compile-path transient gone, but benchmark still regressed to 109.5ms vs 108.3ms best, so clone savings do not beat Arc conversion/to_vec overhead on worker-session open. Rollback reason: worse primary metric. Next action hint: leave worker metadata owned/simple and look at chunk scheduling or per-root deep-force costs instead.","timestamp":1776546384853,"segment":2,"confidence":166.38909784653757,"iterationTokens":12185}
{"run":35,"commit":"38998b3","metric":0,"metrics":{},"status":"crash","description":"Hypothesis: avoid full per-worker deep export by deep-evaluating only the selected top-level field through a new `Context::eval_expr_deep_for_export` helper in Nickel, reusing one worker shallow top-level expr. Crash: crunch-eval depends on crates.io `nickel-lang` 2.0.0 here, not the edited vendored source, so the new helper was invisible at compile time; worker error plumbing also tried `to_string()` on raw `nickel_lang::Error`. Rollback reason: experiment could not compile. Next action hint: use only existing public Nickel APIs in crunch-eval, or patch dependency source first before trying new Context methods.","timestamp":1776547030172,"segment":2,"confidence":166.38909784653757,"iterationTokens":35206}
{"run":36,"commit":"38998b3","metric":0,"metrics":{},"status":"crash","description":"Hypothesis: add adaptive serial fallback for bounded selected/all-root forcing when each worker chunk would be tiny, so small jobs avoid thread/session overhead and reuse one deep-export session. Crash: first cut mismatched the current Arc-backed `open_worker_source` signature and failed to compile with `expected Arc<[OsString]>` / `expected Arc<str>`. Rollback reason: compile error in fallback helper. Next action hint: keep the fallback idea but match the live worker-input types, then rerun.","timestamp":1776547158647,"segment":2,"confidence":166.38909784653757,"iterationTokens":13049}
{"run":37,"commit":"38998b3","metric":117595186,"metrics":{},"status":"discard","description":"Hypothesis: bounded root forcing should fall back to one serial worker session when each worker chunk is tiny (chunk_len <= 4), avoiding thread/session overhead on small jobs like the 16-root wide fixture at concurrency=4. Result regressed badly to 117.6ms vs 108.3ms best, so the serial fallback lost more than it saved under the current Arc-backed worker-input path. Rollback reason: worse primary metric. Next action hint: keep bounded parallel dispatch for this workload and inspect why the serial helper path is slower than the existing eager-all-roots guardrail before trying more routing heuristics.","timestamp":1776547207301,"segment":2,"confidence":163.28351887992912,"iterationTokens":5599}
{"run":38,"commit":"38998b3","metric":0,"metrics":{},"status":"crash","description":"Hypothesis: retest the tiny-chunk serial fallback on the real owned String/Vec worker metadata instead of the discarded Arc-backed variant, so small bounded jobs reuse one session without the Arc regression. Crash: first rebase back to owned worker metadata still left one `force_worker_assignment` call site passing owned clones into the restored `&[OsString]` / `&str` `open_worker_source` signature. Rollback reason: compile error from incomplete type rollback. Next action hint: finish the owned-worker rollback consistently, then rerun the serial-fallback measurement.","timestamp":1776547302123,"segment":2,"confidence":163.28351887992912,"iterationTokens":5997}
