{"run":39,"commit":"1483b08","metric":106636987,"metrics":{},"status":"keep","description":"Switched bounded worker fan-out from `std::thread::spawn` to `std::thread::scope`, letting worker closures borrow the shared worker input instead of cloning it into `'static` threads. This dropped parallel_all_roots_total_wall_ns from the prior 108.3ms best to 106.6ms on the 16-root fixture; eager all-roots guardrail stayed healthy at 61.6ms and selected-root force counts remained 1/0.","timestamp":1776547367553,"segment":2,"confidence":164.39254957582642,"iterationTokens":4758}
{"run":40,"commit":"1483b08","metric":126025192,"metrics":{},"status":"discard","description":"Hypothesis: after switching to scoped threads, worker results already arrive in request order, so removing per-chunk label Vec clones and the final result sort should trim bounded fan-out overhead. Result cratered to 126.0ms vs 106.6ms best; the borrowed-slice/lifetime reshaping clearly hurt codegen more than it saved in tiny result handling. Rollback reason: much worse primary metric. Next action hint: keep the simpler owned WorkerAssignment/result structs and look elsewhere, likely around session open or thread launch itself rather than final ordering bookkeeping.","timestamp":1776547432951,"segment":2,"confidence":142.62912258383196,"iterationTokens":4786}
{"run":41,"commit":"a5ec2fa","metric":106213332,"metrics":{},"status":"keep","description":"Capped effective worker count so bounded forcing keeps at least 8 requested roots per worker before fanning out, which trims redundant whole-session worker setup on small root sets while still honoring the caller's upper concurrency bound. On the 16-root fixture this reduces effective workers from 4 to 2 and improves parallel_all_roots_total_wall_ns from 106.64ms to 106.21ms; selected-root counts stayed 1/0 and eager all-roots guardrail stayed healthy at 62.9ms.","timestamp":1776547536554,"segment":2,"confidence":136.60055029298388,"iterationTokens":5470}
{"run":42,"commit":"a5ec2fa","metric":0,"metrics":{},"status":"crash","description":"Hypothesis: once effective worker count is clamped, worker hot path can skip a second string lookup by forcing roots from already-selected `RootLabel`s instead of calling `session.force_root(label)` and re-searching `session.labels`. Crash: first cut moved `worker_labels` into `open_worker_source` and then tried to iterate it again, so borrow checker rejected the worker loop. Rollback reason: compile error from ownership mistake in the known-label path. Next action hint: either iterate over `session.root_labels()` after session construction or clone only the small selected label vector before moving it.","timestamp":1776547601695,"segment":2,"confidence":136.60055029298388,"iterationTokens":5194}
{"run":43,"commit":"a5ec2fa","metric":0,"metrics":{},"status":"crash","description":"Hypothesis: keep the known-RootLabel fast path but iterate the worker session’s own selected labels, so worker hot path avoids repeated string lookup without extra plumbing. Crash: borrowing `session.root_labels()` for iteration conflicts with the mutable borrow needed for `force_root_with_known_label`, so the compiler rejected the loop. Rollback reason: mutable/immutable borrow conflict in the worker loop. Next action hint: clone the small selected label vector once after session construction, then reuse those owned `RootLabel`s for the known-label force path.","timestamp":1776547629897,"segment":2,"confidence":136.60055029298388,"iterationTokens":1951}
{"run":44,"commit":"a5ec2fa","metric":126311020,"metrics":{},"status":"discard","description":"Hypothesis: after worker-count clamping, preselected worker labels should drive forcing directly through a `force_root_with_known_label` helper, avoiding repeated `session.force_root(label)` linear scans over the small selected label set. Result cratered to 126.3ms vs 106.2ms best; cloning the selected labels once and reshaping the helper path hurt codegen far more than the tiny lookup cost. Rollback reason: much worse primary metric. Next action hint: keep the plain string-label worker loop and focus on bigger overheads than per-root label lookup.","timestamp":1776547662014,"segment":2,"confidence":113.20762840273616,"iterationTokens":1524}
{"run":45,"commit":"a5ec2fa","metric":106972909,"metrics":{},"status":"discard","description":"Hypothesis: raise `MIN_ROOTS_PER_WORKER` from 8 to 16 so the 16-root workload collapses to one worker, cutting one more whole-session deep-eval and thread launch from the bounded path. Result regressed slightly to 106.97ms vs 106.21ms best, so one-worker routing is a bit worse than the current two-worker clamp on this fixture. Rollback reason: worse primary metric. Next action hint: keep the 8-roots-per-worker clamp and probe other worker-setup overheads instead of pushing all the way to one worker.","timestamp":1776547687697,"segment":2,"confidence":109.13277774697973,"iterationTokens":1266}
{"run":46,"commit":"a5ec2fa","metric":111157017,"metrics":{},"status":"discard","description":"Hypothesis: tune the minimum-roots-per-worker clamp from 8 down to 6 so the 16-root workload uses 3 workers instead of 2, which might better balance redundant worker setup against available parallelism. Result regressed to 111.16ms vs 106.21ms best, so 3 workers are clearly worse than the current 2-worker clamp on this fixture. Rollback reason: worse primary metric. Next action hint: keep the 8-root threshold; the local search now shows 1 worker slower, 3 workers slower, and 2 workers best so far.","timestamp":1776547733440,"segment":2,"confidence":131.212479395896,"iterationTokens":3065}
{"run":47,"commit":"a5ec2fa","metric":108021849,"metrics":{},"status":"discard","description":"Hypothesis: after switching to scoped threads, the old Arc-backed worker/session metadata may no longer help and owned String/Vec fields could give better codegen than Arc conversions. Result regressed to 108.02ms vs 106.21ms best, so the current Arc-backed metadata is still slightly better in the scoped+clamped path on this fixture. Rollback reason: worse primary metric. Next action hint: keep the Arc-backed session metadata and probe other overheads instead of reverting that earlier reshape.","timestamp":1776547796918,"segment":2,"confidence":166.55584678980563,"iterationTokens":5172}
{"run":48,"commit":"a5ec2fa","metric":316532977,"metrics":{},"status":"discard","description":"Hypothesis: specialize `force_all_roots_bounded` so the primary workload sends contiguous `RootLabel` chunks directly to workers instead of cloning a full `Vec<String>` and re-selecting labels by string before every worker session. Result exploded to 316.5ms vs 106.2ms best, so the dedicated all-roots worker path hurt codegen or duplicated enough setup to swamp the saved string-selection work. Rollback reason: catastrophically worse primary metric. Next action hint: keep the shared selected-root worker machinery even for all-roots; the extra specialization is not worth it on this path.","timestamp":1776547913542,"segment":2,"confidence":131.212479395896,"iterationTokens":5155}
{"run":49,"commit":"a5ec2fa","metric":106830576,"metrics":{},"status":"discard","description":"Hypothesis: scoped workers already join in assignment order, so the final sort over `IndexedRoot.index` should be redundant and removable. Result regressed slightly to 106.83ms vs 106.21ms best, and the change also left an `IndexedRoot.index` warning behind, so the explicit sort is not worth touching here. Rollback reason: worse primary metric. Next action hint: keep the current sort-and-index bookkeeping and search for a larger win than this tiny tail cleanup.","timestamp":1776547960189,"segment":2,"confidence":161.07642540369787,"iterationTokens":1747}
{"run":50,"commit":"a5ec2fa","metric":152782403,"metrics":{},"status":"discard","description":"Hypothesis: session open still re-runs a full top-level `eval_shallow` during discovery, so deriving labels directly from the already-available `shallow_expr` from `open_source` should cut discovery overhead for the parallel benchmark. Result regressed badly to 152.78ms vs 106.21ms best, so this refactor hurt optimized codegen or invalidated a beneficial sharing path instead of saving work. Rollback reason: much worse primary metric. Next action hint: keep the existing discovery flow; the duplicate-looking top-level shallow evaluation is apparently cheaper than this reshaped label-discovery helper path.","timestamp":1776548139837,"segment":2,"confidence":129.4775474448215,"iterationTokens":6432}
{"run":51,"commit":"a5ec2fa","metric":273390886,"metrics":{},"status":"discard","description":"Hypothesis: with the current 2-worker clamp, one assignment can run on the caller thread while only the remaining assignments spawn helper threads, saving one spawn/join pair on the hot path. Result cratered to 273.39ms vs 106.21ms best, so this mixed local+spawn scheduling reshaped the hot path badly enough to swamp the saved spawn cost. Rollback reason: catastrophically worse primary metric. Next action hint: keep the simpler all-scoped-worker fan-out; thread-count savings need a different design than this local-worker split.","timestamp":1776548254786,"segment":2,"confidence":106.75331229887658,"iterationTokens":2441}
{"run":52,"commit":"a5ec2fa","metric":0,"metrics":{},"status":"crash","description":"Hypothesis: collect syscall-level evidence for the current best code by stracing the benchmark binary directly before more code changes. Crash: autoresearch harness rejected the command because this repo requires experiments to run through `./autoresearch.sh`, not custom benchmark invocations. Rollback reason: harness policy rejection, no code change measured. Next action hint: if more profiling evidence is needed, wrap the profiling tool around `./autoresearch.sh` itself or use non-experiment shell commands outside the autoresearch runner.","timestamp":1776548280807,"segment":2,"confidence":106.75331229887658,"iterationTokens":2441}
{"run":53,"commit":"a5ec2fa","metric":233627235,"metrics":{},"status":"discard","description":"Hypothesis: worker threads are tiny and short-lived, so spawning them with a much smaller stack via `Builder::spawn_scoped(...).stack_size(512 KiB)` might trim spawn overhead and memory pressure. Result cratered to 233.63ms vs 106.21ms best, so custom builder-based spawning is far worse here than plain scoped-thread spawning. Rollback reason: catastrophically worse primary metric. Next action hint: keep default scoped-thread spawning; the builder path adds too much overhead on this hot path.","timestamp":1776548453582,"segment":2,"confidence":101.45367849256,"iterationTokens":6246}
{"run":54,"commit":"a5ec2fa","metric":247319974,"metrics":{},"status":"discard","description":"Hypothesis: for record-shaped root sets, each worker can wrap the original source into a smaller record containing only its assigned labels, so `eval_deep_for_export` forces only that subset instead of all roots in every worker session. Result cratered to 247.32ms vs 106.21ms best; the wrapper-source generation and Nickel field-projection path are far worse than the current full-source worker sessions on this fixture. Rollback reason: catastrophically worse primary metric. Next action hint: drop the wrapper-source idea from the hot path unless Nickel exposes a real per-expression deep-export API.","timestamp":1776548807269,"segment":2,"confidence":96.65534553476706,"iterationTokens":6246}
{"run":55,"commit":"a5ec2fa","metric":267891072,"metrics":{},"status":"discard","description":"Hypothesis: patch crunch to use the vendored `nickel-lang`, add `Context::eval_expr_deep_for_export`, and change worker forcing to deep-export only each selected top-level field from one shallow worker expr instead of `eval_deep_for_export(full_source)` per worker. Result cratered to 267.89ms vs 106.21ms best, so this per-field deep-export path is much slower than the existing whole-session deep-export worker path on the wide fixture even when the API is available. Rollback reason: catastrophically worse primary metric. Next action hint: drop this path for now; remaining wins likely need thread reuse or different Nickel internals, not per-field export through the current public wrapper.","timestamp":1776549283070,"segment":2,"confidence":74.96687946744065,"iterationTokens":1073}
{"run":56,"commit":"a5ec2fa","metric":138335127,"metrics":{},"status":"discard","description":"Hypothesis: once bounded forcing clamps to only 2 effective workers on the 16-root fixture, `force_all_roots_bounded` should bypass the isolated-worker path entirely and reuse the coordinator session’s eager `force_all_roots()` fast path, eliminating duplicate worker deep exports. Result still regressed badly to 138.34ms vs 106.21ms best, so this adaptive serial handoff does not inherit the standalone eager-all-roots guardrail cost the way expected. Rollback reason: worse primary metric. Next action hint: keep bounded all-roots on the current isolated-worker machinery; the eager serial path is not a drop-in win inside this API boundary.","timestamp":1776549712994,"segment":2,"confidence":64.73877372241076,"iterationTokens":10874}
{"run":57,"commit":"a5ec2fa","metric":244362069,"metrics":{},"status":"discard","description":"Hypothesis: replace per-call scoped thread spawning with cached Rayon thread pools keyed by effective bounded concurrency, so repeated benchmark samples reuse worker threads instead of paying OS-thread spawn/join each call. Result cratered to 244.36ms vs 106.21ms best, so this Rayon pool path adds far more scheduling/abstraction overhead than it saves on the current worker workload. Rollback reason: catastrophically worse primary metric. Next action hint: drop external pool abstraction here; if thread reuse matters, it likely needs a much thinner purpose-built path.","timestamp":1776550014570,"segment":2,"confidence":46.2237208035137,"iterationTokens":3863}
{"run":58,"commit":"a5ec2fa","metric":0,"metrics":{},"status":"crash","description":"Hypothesis: for the common 2-worker-clamped all-roots case, do one coordinator deep export and deserialize each extracted root through JSON instead of paying one whole-program deep export per worker. Crash: first cut borrowed `self` through `ensure_deep_expr()` while also mutating `forced_root_count`, so the compiler rejected the helper with E0503/E0506. Rollback reason: borrow-check failure in the coordinator JSON path. Next action hint: clone or otherwise detach the deep expr before the per-root loop, then rerun the single-deep-export experiment.","timestamp":1776550243585,"segment":2,"confidence":46.2237208035137,"iterationTokens":4960}
{"run":59,"commit":"a5ec2fa","metric":153583489,"metrics":{},"status":"discard","description":"Hypothesis: for the common 2-worker-clamped all-roots case, do one coordinator deep export and deserialize each extracted root through JSON instead of paying one whole-program deep export per worker. Result still regressed badly to 153.58ms vs 106.21ms best, so the extra JSON export/parse path costs more than the duplicated worker deep exports it removes on this fixture. Rollback reason: worse primary metric. Next action hint: drop coordinator JSON deserialization as an optimization path; any single-deep-export design likely needs a much cheaper intermediate than JSON.","timestamp":1776550460116,"segment":2,"confidence":36.30641274615757,"iterationTokens":2136}
{"run":60,"commit":"a5ec2fa","metric":0,"metrics":{},"status":"crash","description":"Hypothesis: replace per-call scoped thread spawning with a very thin custom persistent worker pool built from std channels and long-lived threads, avoiding the heavy Rayon abstraction that regressed earlier. Crash: first cut hit `E0310` because job results crossing the persistent pool threads need `T: 'static` on the pool submission path. Rollback reason: compile error from missing lifetime bound in the custom pool helper. Next action hint: add the explicit `'static` bound where the job result crosses the worker-thread boundary, then rerun the thin custom-pool experiment.","timestamp":1776550622370,"segment":2,"confidence":36.30641274615757,"iterationTokens":3932}
{"run":61,"commit":"e24c1a1","metric":105369900,"metrics":{},"status":"keep","description":"Replaced per-call scoped worker spawning with a very thin custom persistent bounded worker pool built from std channels and long-lived threads. Unlike the earlier Rayon pool, this keeps scheduling overhead minimal while reusing worker threads across the benchmark’s repeated bounded calls. parallel_all_roots_total_wall_ns improved from 106.21ms to 105.37ms; selected-root counts stayed 1/0 and eager all-roots guardrail stayed healthy at 64.1ms.","timestamp":1776550962688,"segment":2,"confidence":45.351299651391635,"iterationTokens":4561}
{"run":62,"commit":"e24c1a1","metric":117629693,"metrics":{},"status":"discard","description":"Hypothesis: with the new custom persistent worker pool, wrapping the shared worker input in one outer `Arc` and cloning that per assignment might cut per-job metadata cloning further than cloning `IsolatedWorkerInput` directly. Result regressed badly to 117.63ms vs 105.37ms best, so the extra outer `Arc` indirection is worse than the existing direct clone path. Rollback reason: worse primary metric. Next action hint: keep the simple `IsolatedWorkerInput` clone per job and avoid layering more pointer indirection onto the hot path.","timestamp":1776551019467,"segment":2,"confidence":63.47218628425067,"iterationTokens":3533}
{"run":63,"commit":"b938db6","metric":104876968,"metrics":{},"status":"keep","description":"Tightened the custom persistent worker pool by switching both job delivery and result delivery to bounded `sync_channel(1)` queues. The bounded all-roots path only has one outstanding job/result per worker at a time, so the simpler bounded queue path trims channel overhead without changing semantics. parallel_all_roots_total_wall_ns improved from 105.37ms to 104.88ms; selected-root counts stayed 1/0 and eager all-roots guardrail remained healthy.","timestamp":1776551068147,"segment":2,"confidence":62.41231246558591,"iterationTokens":3457}
{"run":64,"commit":"b938db6","metric":106747906,"metrics":{},"status":"discard","description":"Hypothesis: the bounded worker pool does not need atomic round-robin selection on this hot path because assignments are submitted serially; directly targeting worker slots from the caller should shave a little pool bookkeeping. Result regressed to 106.75ms vs 104.88ms best and also introduced warnings from the now-unused generic submit path, so the extra submit helper split is not worth it. Rollback reason: worse primary metric. Next action hint: keep the simpler atomic round-robin submit path; sender-slot selection is not the bottleneck.","timestamp":1776551105160,"segment":2,"confidence":63.71704100281442,"iterationTokens":1989}
{"run":65,"commit":"b938db6","metric":106092511,"metrics":{},"status":"discard","description":"Hypothesis: the custom persistent worker pool may be even cheaper with rendezvous job delivery (`sync_channel(0)`) because workers are already parked waiting for the next bounded task, so no one-item job buffer is needed. Result regressed to 106.09ms vs 104.88ms best, so forcing sender/worker rendezvous is a bit worse than the current one-slot buffered job queue. Rollback reason: worse primary metric. Next action hint: keep the one-slot buffered job queue; it seems to smooth worker handoff better than strict rendezvous.","timestamp":1776551134348,"segment":2,"confidence":70.05821394522894,"iterationTokens":965}
{"run":66,"commit":"b938db6","metric":108366712,"metrics":{},"status":"discard","description":"Hypothesis: after switching to the persistent bounded worker pool, the old 8-roots-per-worker clamp may be too conservative and the 16-root fixture might now benefit from reusing all 4 workers. Lowering `MIN_ROOTS_PER_WORKER` to 4 makes the benchmark use 4 workers again, but it regressed to 108.37ms vs 104.88ms best. Rollback reason: worse primary metric. Next action hint: keep the clamp above 4; cheaper worker reuse does not make 4-way fan-out worthwhile on this workload.","timestamp":1776551195832,"segment":2,"confidence":90.04110450405396,"iterationTokens":134}
{"run":67,"commit":"b938db6","metric":107403188,"metrics":{},"status":"discard","description":"Hypothesis: persistent worker reuse may make a 3-worker split best even if 4 workers and 1 worker were worse, so lowering `MIN_ROOTS_PER_WORKER` to 6 would retune the 16-root fixture to 3 workers. Result still regressed to 107.40ms vs 104.88ms best. Rollback reason: worse primary metric. Next action hint: keep the current 8-root clamp; even after persistent worker reuse, the local search still says 2 workers beat both 3 and 4.","timestamp":1776551220425,"segment":2,"confidence":93.72281618382463,"iterationTokens":1026}
{"run":68,"commit":"b938db6","metric":109297400,"metrics":{},"status":"discard","description":"Hypothesis: the thin custom worker pool might get a little cheaper by swapping std `sync_channel(1)` for crossbeam bounded channels while keeping the same one-job/one-result semantics. Result regressed to 109.30ms vs 104.88ms best, so the extra dependency/abstraction does not beat std’s bounded channels on this tiny hot path. Rollback reason: worse primary metric. Next action hint: keep std bounded channels; channel implementation choice is no longer the main lever.","timestamp":1776551330186,"segment":2,"confidence":97.71844857215193,"iterationTokens":4107}
