{"run":89,"commit":"2e98a60","metric":102278978,"metrics":{},"status":"keep","description":"Confirmation rerun after reverting the noisy parking_lot variant. The restored std-sync result-slot path improved again, from 103.10ms down to 102.28ms, which strengthens the case that the std-sync reusable result-slot design is the trustworthy post-confirmation winner and the earlier parking_lot low sample was noise.","timestamp":1776988069345,"segment":2,"confidence":154.65143196763506,"iterationTokens":1160,"asi":{"hypothesis":"the explicit std-sync revert should keep beating the confirmed parking_lot rerun if the parking_lot win was noise","observed_improvement_ns":"825106","kept_because":"same-code confirmation rerun improved again and stayed clearly below the confirmed parking_lot rerun","next_action_hint":"with the result-slot design stabilized, either expose effective bounded concurrency in benchmark output or move to a genuinely new seam outside worker result plumbing"}}
{"run":90,"commit":"424db31","metric":103540868,"metrics":{},"status":"discard","description":"Tried removing the per-submit result-slot clear step now that the pool schedules at most one job per worker per call and every call drains all slots before returning. The change preserved behavior in the focused session tests but regressed from the current 102.28ms best to 103.54ms, so the explicit clear remains the better shape on this hot path.","timestamp":1776988371801,"segment":2,"confidence":151.02063760753526,"iterationTokens":1160,"asi":{"hypothesis":"skipping the redundant-looking result-slot clear would shave one mutex lock/unlock per submitted worker job","rollback_reason":"primary metric regressed by about 1.26ms versus the current best kept code","next_action_hint":"keep the current result-slot clear and shift away from more result-slot micro-tuning toward measurement accuracy or a new higher-level seam","observed_regression_ns":"1261890","notes":"The edit also introduced an unused-method warning because `clear()` became dead code; the warning disappeared again after rollback."}}
{"run":91,"commit":"424db31","metric":108784076,"metrics":{},"status":"discard","description":"No-code confirmation rerun on the current std-sync reusable result-slot path. This isolated rerun landed much slower at 108.78ms versus the earlier 102.28ms confirmation, so the current benchmark remains noisy enough that we should avoid over-trusting single low samples and keep looking for changes that beat the baseline more decisively.","timestamp":1776988670691,"segment":2,"confidence":151.1454243774849,"iterationTokens":14491,"asi":{"hypothesis":"the current reusable result-slot implementation might hold near the recent ~102ms confirmations on another isolated rerun","rollback_reason":"same-code rerun regressed sharply and did not confirm the earlier low sample range","next_action_hint":"prefer changes with larger margins than the current noise band, or improve measurement fidelity (for example effective concurrency reporting) before trusting another tiny micro-win","observed_regression_ns":"6505098","notes":"There were no code changes in this run; the result is pure measurement evidence about the current noise envelope."}}
{"run":92,"commit":"424db31","metric":171942634,"metrics":{},"status":"discard","description":"Tried exposing actual effective bounded concurrency in the benchmark outputs by adding an `effective_bounded_root_concurrency()` helper on `EvaluationSession` and wiring both benchmark entrypoints to record the clamped worker count instead of the configured concurrency. This unexpectedly cratered the primary metric from the current ~102ms region to 171.94ms, so even this seemingly harmless measurement-fidelity plumbing perturbed the hot path enough to reject for now.","timestamp":1776989015787,"segment":2,"confidence":151.02063760753526,"iterationTokens":6598,"asi":{"hypothesis":"recording actual effective bounded concurrency would improve benchmark fidelity without materially changing the measured runtime","rollback_reason":"primary metric regressed catastrophically despite the change being intended as measurement-only plumbing","next_action_hint":"do not mix benchmark-reporting tweaks into the hot path casually; if we revisit metric fidelity, isolate it much more carefully or measure it outside the benchmarked region","observed_regression_ns":"69663656","notes":"Focused crunch-eval session tests still passed before the run, so the failure was purely benchmark performance."}}
{"run":93,"commit":"b516c79","metric":65425802,"metrics":{},"status":"keep","description":"Reuse the coordinator session inside `force_all_roots_bounded()` for small all-root sets instead of cloning the whole request into isolated workers. On the fixed 16-root fixture the bounded path previously paid two redundant full-program deep exports; the new small-set fallback collapses the primary metric from 102.28ms to 65.43ms and brings bounded all-roots back down to the eager all-roots cost envelope.","timestamp":1776990322035,"segment":2,"confidence":158.20294558617803,"iterationTokens":6598,"asi":{"hypothesis":"for small all-root sets whose effective bounded fan-out is only one or two workers, reusing the existing session's in-process all-roots path would beat isolated worker sessions because the worker path duplicates whole-program deep export work","observed_improvement_ns":"36853176","kept_because":"the primary metric improved massively and the guardrails stayed healthy: discovery remained ~47.11ms, selected-root stayed ~65.35ms with force counts 1/0, and eager all-roots stayed ~64.97ms","mechanism":"force_all_roots_bounded()/force_all_roots_with_policy() now compute effective bounded concurrency and reuse self.force_all_roots() for small all-root sets instead of routing through isolated worker sessions","next_action_hint":"the remaining primary-metric ceiling is now session open/root discovery, so future experiments should target cheaper open_file/discovery work or only revisit reporting for the now-misleading concurrency metric outside the hot path"}}
{"run":94,"commit":"b2b2d6b","metric":64075279,"metrics":{},"status":"keep","description":"No-code confirmation rerun of the small-set coordinator-session fallback. The same code improved again from 65.43ms to 64.08ms, confirming that the bounded all-roots path now reliably tracks the eager all-roots cost envelope on the fixed 16-root fixture instead of paying the old duplicated worker deep-export penalty.","timestamp":1776990419570,"segment":2,"confidence":157.63816835512105,"iterationTokens":7295,"asi":{"hypothesis":"if the new small-set all-roots fallback is a real structural win, a fresh isolated rerun of the same code should stay near the new ~65ms band rather than bouncing back toward the old ~102ms worker-path band","observed_improvement_ns":"1350523","kept_because":"same-code confirmation rerun stayed in the new low band and improved slightly again","mechanism":"no code change; this run purely confirmed the already-landed session-reuse routing inside force_all_roots_bounded()","next_action_hint":"treat the worker duplication problem as solved for the current fixture and shift future experiments toward open_file/discovery costs or out-of-band reporting of the now-misleading concurrency metric"}}
{"run":95,"commit":"0d64a5b","metric":59553669,"metrics":{},"status":"keep","description":"Parse the source once to discover safe top-level static record labels and skip the expensive shallow Nickel evaluation during session open when the file is obviously a let-wrapped record package set. On the fixed wide fixture that collapses root discovery from about 47ms to 1.75ms and pulls the primary metric down from 64.08ms to 59.55ms without changing the later deep-export semantics.","timestamp":1776991126233,"segment":2,"confidence":157.80569889574875,"iterationTokens":46922,"asi":{"hypothesis":"a parse-only static record-label fast path for clearly syntactic top-level package-set records would remove most open_file/discovery cost without changing force-time behavior","observed_improvement_ns":"4521610","kept_because":"the primary metric improved materially and the guardrails stayed healthy: discovery dropped to ~1.75ms, selected-root total improved to ~58.44ms with force counts 1/0, and eager all-roots improved to ~60.61ms","mechanism":"open_source() now tries discover_static_record_labels() first; when parsing proves the source is a safe static top-level record without a top-level name field, the session seeds Record labels directly and skips eval_shallow/discover_roots","next_action_hint":"confirm this parse-only discovery fast path with a no-code rerun, then revisit the remaining dominant cost in selected_root_force / deep export rather than more discovery work"}}
{"run":96,"commit":"74e35e3","metric":59662942,"metrics":{},"status":"keep","description":"No-code confirmation rerun of the parse-only static record discovery fast path. The same code stayed in the new low band at 59.66ms, confirming that discovery is now effectively free on the fixed let-wrapped package-set fixture and that the remaining ceiling is deep export rather than session open.","timestamp":1776991269591,"segment":2,"confidence":151.29983705016852,"iterationTokens":2701,"asi":{"hypothesis":"if the static top-level record parser fast path is a real improvement, a fresh isolated rerun should stay near the new ~60ms band instead of bouncing back toward the old ~64ms post-worker-fix band","observed_regression_ns":"109273","kept_because":"same-code confirmation rerun reproduced the improvement within a tiny margin and kept the primary metric well below the old discovery-heavy band","mechanism":"no code change; this run purely confirmed the already-landed parse-only discovery routing in open_source()","next_action_hint":"treat session-open/root discovery as solved for this fixture and shift future experiments toward cheaper deep export / selected-root force behavior"}}
